{
  "$schema": "https://stillopen.org/benchmark-kit/schemas/guided-observations.schema.json",
  "schemaVersion": 1,
  "kind": "benchmark-guided-observations",
  "id": "zpdf-web-2026-08-11-observations",
  "toolId": "zpdf-web-2026-08-11",
  "cases": [
    {
      "caseId": "qpdf-form-corrupt-startxref",
      "productOutcome": "error",
      "attemptedAt": "2026-08-11T22:29:20.101Z",
      "productMessage": "Unable to repair the PDF file.",
      "operatorNote": "The nine-file batch stopped at an error, so all cases were rerun individually in frozen order."
    },
    {
      "caseId": "qpdf-form-missing-eof",
      "productOutcome": "success",
      "attemptedAt": "2026-08-11T22:29:26.035Z",
      "productMessage": "PDF repaired successfully! Download (31.38 KB)",
      "returnedFiles": [
        {
          "path": "cases/qpdf-form-missing-eof/results/repaired.pdf",
          "recommended": true
        }
      ],
      "operatorNote": "Captured from the individual result tab; downloaded as repaired_input (1).pdf after the final healthy-control tab and the PDF24 ZIP were downloaded first."
    },
    {
      "caseId": "qpdf-11-pages-missing-startxref",
      "productOutcome": "error",
      "attemptedAt": "2026-08-11T22:29:31.057Z",
      "productMessage": "Unable to repair the PDF file."
    },
    {
      "caseId": "qpdf-11-pages-trailing-bytes",
      "productOutcome": "success",
      "attemptedAt": "2026-08-11T22:29:36.193Z",
      "productMessage": "PDF repaired successfully! Download (4.03 KB)",
      "returnedFiles": [
        {
          "path": "cases/qpdf-11-pages-trailing-bytes/results/repaired.pdf",
          "recommended": true
        }
      ],
      "operatorNote": "Captured from the individual result tab; downloaded as repaired_input (2).pdf."
    },
    {
      "caseId": "qpdf-issue-179-startxref-out-of-range",
      "productOutcome": "error",
      "attemptedAt": "2026-08-11T22:29:41.214Z",
      "productMessage": "Unable to repair the PDF file."
    },
    {
      "caseId": "qpdf-issue-179-nonnumeric-startxref",
      "productOutcome": "error",
      "attemptedAt": "2026-08-11T22:29:46.233Z",
      "productMessage": "Unable to repair the PDF file."
    },
    {
      "caseId": "healthy-qpdf-form",
      "productOutcome": "success",
      "attemptedAt": "2026-08-11T22:29:51.373Z",
      "productMessage": "PDF repaired successfully! Download (31.38 KB)",
      "returnedFiles": [
        {
          "path": "cases/healthy-qpdf-form/results/repaired.pdf",
          "recommended": true
        }
      ],
      "operatorNote": "Captured from the individual result tab; downloaded as repaired_input (3).pdf."
    },
    {
      "caseId": "healthy-qpdf-11-pages",
      "productOutcome": "success",
      "attemptedAt": "2026-08-11T22:29:56.524Z",
      "productMessage": "PDF repaired successfully! Download (4.03 KB)",
      "returnedFiles": [
        {
          "path": "cases/healthy-qpdf-11-pages/results/repaired.pdf",
          "recommended": true
        }
      ],
      "operatorNote": "Captured from the individual result tab; downloaded as repaired_input (4).pdf."
    },
    {
      "caseId": "healthy-qpdf-issue-179",
      "productOutcome": "success",
      "attemptedAt": "2026-08-11T22:30:01.527Z",
      "productMessage": "PDF repaired successfully! Download (1.07 KB)",
      "returnedFiles": [
        {
          "path": "cases/healthy-qpdf-issue-179/results/repaired.pdf",
          "recommended": true
        }
      ],
      "operatorNote": "Captured from the individual result tab; this was downloaded first as repaired_input.pdf. No upload, account, quota, or payment boundary appeared."
    }
  ]
}
