{
  "$schema": "https://stillopen.org/benchmark-kit/schemas/guided-observations.schema.json",
  "schemaVersion": 1,
  "kind": "benchmark-guided-observations",
  "id": "pdf2go-online-2026-08-11-observations",
  "toolId": "pdf2go-online-2026-08-11",
  "cases": [
    {
      "caseId": "qpdf-form-corrupt-startxref",
      "productOutcome": "success",
      "attemptedAt": "2026-08-11T22:47:07.348Z",
      "productMessage": "Done",
      "returnedFiles": [
        {
          "path": "cases/qpdf-form-corrupt-startxref/results/repaired.pdf",
          "recommended": true
        }
      ],
      "operatorNote": "Free batch 1 of 3, returned file 1 of 3 (26.02 KB). Anonymous session began with 8 credits."
    },
    {
      "caseId": "qpdf-form-missing-eof",
      "productOutcome": "success",
      "attemptedAt": "2026-08-11T22:47:07.348Z",
      "productMessage": "Done",
      "returnedFiles": [
        {
          "path": "cases/qpdf-form-missing-eof/results/repaired.pdf",
          "recommended": true
        }
      ],
      "operatorNote": "Free batch 1 of 3, returned file 2 of 3 (31.74 KB)."
    },
    {
      "caseId": "qpdf-11-pages-missing-startxref",
      "productOutcome": "success",
      "attemptedAt": "2026-08-11T22:47:07.348Z",
      "productMessage": "Done",
      "returnedFiles": [
        {
          "path": "cases/qpdf-11-pages-missing-startxref/results/repaired.pdf",
          "recommended": true
        }
      ],
      "operatorNote": "Free batch 1 of 3, returned file 3 of 3 (14.84 KB)."
    },
    {
      "caseId": "qpdf-11-pages-trailing-bytes",
      "productOutcome": "success",
      "attemptedAt": "2026-08-11T22:47:07.348Z",
      "productMessage": "Done",
      "returnedFiles": [
        {
          "path": "cases/qpdf-11-pages-trailing-bytes/results/repaired.pdf",
          "recommended": true
        }
      ],
      "operatorNote": "Free batch 2 of 3, the only returned file (10.73 KB)."
    },
    {
      "caseId": "qpdf-issue-179-startxref-out-of-range",
      "productOutcome": "error",
      "attemptedAt": "2026-08-11T22:47:07.348Z",
      "productMessage": "Could not convert this file. The file seems to be broken and we are unable to fix it.",
      "operatorNote": "Free batch 2 of 3. No output was returned."
    },
    {
      "caseId": "qpdf-issue-179-nonnumeric-startxref",
      "productOutcome": "error",
      "attemptedAt": "2026-08-11T22:47:07.348Z",
      "productMessage": "Could not convert this file. The file seems to be broken and we are unable to fix it.",
      "operatorNote": "Free batch 2 of 3. No output was returned."
    },
    {
      "caseId": "healthy-qpdf-form",
      "productOutcome": "success",
      "attemptedAt": "2026-08-11T22:47:07.348Z",
      "productMessage": "Done",
      "returnedFiles": [
        {
          "path": "cases/healthy-qpdf-form/results/repaired.pdf",
          "recommended": true
        }
      ],
      "operatorNote": "Free batch 3 of 3, returned file 1 of 3 (6.78 KB)."
    },
    {
      "caseId": "healthy-qpdf-11-pages",
      "productOutcome": "success",
      "attemptedAt": "2026-08-11T22:47:07.348Z",
      "productMessage": "Done",
      "returnedFiles": [
        {
          "path": "cases/healthy-qpdf-11-pages/results/repaired.pdf",
          "recommended": true
        }
      ],
      "operatorNote": "Free batch 3 of 3, returned file 2 of 3 (10.73 KB)."
    },
    {
      "caseId": "healthy-qpdf-issue-179",
      "productOutcome": "success",
      "attemptedAt": "2026-08-11T22:47:07.348Z",
      "productMessage": "Done",
      "returnedFiles": [
        {
          "path": "cases/healthy-qpdf-issue-179/results/repaired.pdf",
          "recommended": true
        }
      ],
      "operatorNote": "Free batch 3 of 3, returned file 3 of 3 (31.74 KB). The three-task cohort consumed 3 anonymous credits; more than 3 files in one task showed a premium notice."
    }
  ]
}
